5055,938085,"lacus. Cras interdum. Nunc sollicitudin commodo ipsum. Suspendisse non leo. Vivamus nibh dolor, nonummy ac, feugiat non, lobortis quis, pede.",18-Dec-24,9998
6509,840678,"sed orci lobortis augue scelerisque mollis. Phasellus libero mauris, aliquam eu, accumsan sed, facilisis vitae, orci. Phasellus dapibus quam quis diam. Pellentesque",11-Nov-23,9998
3252,840678,eget odio. Aliquam vulputate ullamcorper magna. Sed eu eros. Nam consequat dolor vitae dolor. Donec fringilla. Donec feugiat metus sit amet ante. Vivamus non lorem vitae,29-Feb-24,9998
4589,840678,"Sed eu nibh vulputate mauris sagittis placerat. Cras dictum ultricies ligula. Nullam enim. Sed nulla ante, iaculis nec, eleifend non, dapibus rutrum, justo. Praesent",29-Apr-24,9998
7307,840678,"neque sed dictum eleifend, nunc risus varius orci, in consequat enim diam vel arcu. Curabitur ut odio",10-May-24,9998
7607,289774,"et risus. Quisque libero lacus, varius et, euismod et, commodo at, libero. Morbi accumsan laoreet ipsum. Curabitur consequat,",5-Jun-24,9998
9955,289774,"lacus. Aliquam rutrum lorem ac risus. Morbi metus. Vivamus euismod urna. Nullam lobortis quam a felis ullamcorper viverra. Maecenas iaculis aliquet diam. Sed diam lorem, auctor",18-Jun-24,9998
4935,289774,pretium neque. Morbi quis urna. Nunc quis arcu vel quam dignissim pharetra. Nam ac nulla.,6-Jul-24,9002
5025,397884,"venenatis lacus. Etiam bibendum fermentum metus. Aenean sed pede nec ante blandit viverra. Donec tempus, lorem fringilla ornare placerat, orci lacus vestibulum lorem, sit amet",24-Apr-24,9002
8945,397884,"tellus. Nunc lectus pede, ultrices a, auctor non, feugiat nec, diam. Duis mi enim, condimentum eget, volutpat ornare, facilisis eget, ipsum. Donec",18-Dec-24,9002
8649,688100,In faucibus. Morbi vehicula. Pellentesque tincidunt tempus risus. Donec egestas. Duis ac arcu. Nunc mauris. Morbi non sapien molestie orci tincidunt adipiscing. Mauris molestie pharetra,22-Oct-23,9002
7031,575629,"tellus non magna. Nam ligula elit, pretium et, rutrum non, hendrerit id, ante. Nunc mauris sapien, cursus in, hendrerit consectetuer, cursus et, magna. Praesent interdum ligula eu enim.",25-May-23,3996
8559,575629,"velit justo nec ante. Maecenas mi felis, adipiscing fringilla, porttitor vulputate, posuere vulputate, lacus. Cras interdum. Nunc sollicitudin commodo ipsum. Suspendisse non leo. Vivamus nibh dolor, nonummy ac, feugiat",21-Nov-24,3996
6446,537605,"non arcu. Vivamus sit amet risus. Donec egestas. Aliquam nec enim. Nunc ut erat. Sed nunc est, mollis non, cursus non, egestas a, dui.",18-Nov-23,3996
1776,537605,"amet, dapibus id, blandit at, nisi. Cum sociis natoque penatibus et magnis dis parturient montes, nascetur ridiculus mus. Proin vel nisl. Quisque fringilla euismod enim. Etiam gravida molestie",11-Jan-25,3996
5147,752591,"risus a ultricies adipiscing, enim mi tempor lorem, eget mollis lectus pede et risus. Quisque libero lacus, varius et, euismod et, commodo at, libero. Morbi accumsan laoreet ipsum.",20-Feb-24,3731
4530,752591,"scelerisque, lorem ipsum sodales purus, in molestie tortor nibh sit amet orci. Ut sagittis lobortis mauris. Suspendisse aliquet molestie tellus. Aenean egestas hendrerit neque. In ornare sagittis felis. Donec",8-Oct-23,3731
4419,752591,"dictum ultricies ligula. Nullam enim. Sed nulla ante, iaculis nec, eleifend non, dapibus rutrum, justo. Praesent luctus. Curabitur egestas nunc sed libero.",4-May-24,2792
7050,849481,morbi tristique senectus et netus et malesuada fames ac turpis egestas.,14-Nov-24,9002
2896,562336,"elit elit fermentum risus, at fringilla purus mauris a nunc. In",19-Feb-25,6592